	LEV
ما في انكد من انك تيجي ع حالك وتصحا بكير مشان تحضر محاضرة وبالاخر ما بتلحقها 	LEV
  كيف بدك تصير تفهم و انت بتعمللها لايك ع اشي ضد مبادئك بس عشان صورتها عجبتك  	LEV
سدّ بأعالي جبل لبنان؛ بتعرفوا شو اسمه 	LEV
عشانك شبيح خوينا اعتذر لك	LEV
شو بخاف دق عليك ومالاقيك شو بخاف بنص الليل ماحاكيك	LEV
لو بيسكّر بوزروو بقى لعمى بقلبوا ما ضجر وما فهم انّوا ما حدا بالبّلد تايقوا لعمى شو انّو حمار بس كل عمرو هيك ريكوو	LEV
شو مين ماخذة  رجل من  كاليفورنيوم مقنطر بال  بولونيوم	LEV
قولتك لازم يكون معي الوتد   خلص بجيبه احتياط الواحد ما بعرف شو بصيرله	LEV
يعني لولا ما هالدكتور بدو يفصلني كان هسا انا بعمان اوفت	LEV
  فانز نانسي شو عملو بفانز إليسا جلادين 	LEV
وقت تصحى وبقلبك معبا شوق  مافيك تعمل شي غير انك توزعو هون و هون مشان ما يقلب عليك بس مشكلة خاف ينفهم غلط   انو لهل الدرجة كبير الشوق الك	LEV
  بالزمنات كان الحب للشجعان الجبناء تزوجهم امهاتهم حاليا الحب للي معو مصاري  الشجاعة بتعرف شو تعمل فيها هلوساتمسا	LEV
  صبااح الخير والحب سكسيه للتواصل معى فوت هون  زوجه بدويه  وقافى 	LEV
  بغض النظر انو فضولي قتلني شو عم تحضرو  بس اللون الكحلييليقبك  	LEV
  اله ايوا فرجيهم شو يعني محبوبالعرب والملايين الله يزيدهم ويحماك يعقوبشاهين	LEV
  الحريةلأحمد  لما كان التيار الوطني خارج الحكم كان يطالب بحرية التعبير لما صار ب الحكم صار يسجن الناس كرمال بوست ع 	LEV
  هسى في ذمتك دى خلقه زول عندو قروش لصاله وعشاء وحفله بطه سليمان   	LEV
لك منيح طلعوا سمعانين بالقدس 	LEV
  رتويت يا مطيع ل ثلاثينيه للتواصل معى فوت هون  مطلقه سكسيه  مكوة 	LEV
  برضو نفس ما حكت هديل الجملة الصباحية لكل يوم احد لما اطلع ع مؤتة    	LEV
  كل شوي يسألوني شو تغير في وشو صرلي عنن يختفي  عمبتعلقفيك 	LEV
مش قادره اكل اشي بتعرفي هاد الشعور الي تشوفي اكل او بدك تاكلي بتصيري بدك تستفرغي  الـ 	LEV
تورطت وصرت عربي العمى على سنة هالحياة شو بتخزي	LEV
  انا عم بلش حبك انا️ 	LEV
  نظراته الحزينة مو طبيعي شو معبره  	LEV
 تؤبرني توني  الحمدالله انك مو لبناني	LEV
  ع فكرة ما في ولا ام بحياتها حكت لبنتها هيك و مستحيل اصدق  مش عارفة انه لهالدرجة الشباب ماكلين بحالهم مقلب و مفكر 	LEV
حدن بيعرف نحنا شو منستفيد بِ بلاد الأرز بً تقديم وتأخير الساعة كل ستة أشهر صباحو	LEV
شو نفع نقدم الوقت ساعة  وسياسيين هالبلد عم يرجعوه سنين شو نفع نقدم الوقت ساعة  والاعلام وبرامج 	LEV
معقول الجو شو حلوو 	LEV
شو أحسن نظام 	LEV
  وشموهبتك  الله وكيلك كلي مواهب عاد مدري شو اكتب وشو اخلي واحلى موهبه الــ	LEV
شو صحاني عل  و انا معطلة	LEV
بلش الصيف يلا نجهز موسم البحر  	LEV
  عاارفين  شو يعني تماام  يعني بلاوي الكوون في بس ما في گلاام 	LEV
طيب بلكي هو سارقها كمان 	LEV
هاي  شو بتقربلك	LEV
فلاش شو تعني	LEV
  اوامرملكيه وشموهبتك  نفسي اعرف شو موهبتي بالحياة   غير الأكل طبعاً   صباح الدوام والتفائل ️	LEV
  اليوم عطيت عمو ختيار قداحه قام قللي اهم شي بالحياه الحب و حساب بالبنك غير هيك ما في شي بيهم	LEV
  شو حلوة كلمة نجوىكرم وهي عنجد هالقد لبنانية  	LEV
بدك ياني بعلمك كيف	LEV
لحمة شو يعني لحمة	LEV
  على شو  جوليا بطرس  	LEV
هلتعلم إنن كلهم متل بعض وما تشد ع معدتك كرمال حدا	LEV
هجرك بيحرقنا لكن شو بنقلك بدك تفارقنا الله يسهلك	LEV
اذا هلأ بدّعت  ابصر شو راح اعمل على امتحان ال 	LEV
  فيروز تذكرتك ياعلياء  وتذكرت عيونك  يخرب بيت عيونك ياعلياء شو حلوين 	LEV
شو قلت	LEV
شوق عظيم لـ هون 	LEV
يما اعطيني مصاري بدي اطلع مع صحابي يما يا حبيبي معيش مصاري؛ والله يرضى عليك بلاش تطلع الليلة يا الله يما 	LEV
هيدا الحكيم شو بفهموا ما شي هيدي المشكلة  	LEV
  ليشنازلتتظاهر لأنو بـ زمنالمقاومة  صار ساميالجميليمثلني وهوي بفهمك شو دورككمواطن سوشيالفلسطين 	LEV
 شبيح من قمحانة يقاتلون تحت صباط الخسيس الذي يعتمد عليهم اكثر من العلويين لا يوجد نقيصة من اجرام وسلب ونهب وقتل الا وا	LEV
شو هيدا	LEV
ايري بالعرب شو حمير	LEV
شو نوعه بنج الأسنان اللي بيضل تأثيره لتاني يوم 	LEV
ولا أنا ما قدرت يعليهن  الله يستر  بلكي بلحق محاضرة الساعة  	LEV
العراق بلكي	LEV
كس امك شو حمار	LEV
انداري 	LEV
  شو حلو الزمان يجمعنا ونقول  ماعاد في نسيان ونلتقي عطول  “  ” 	LEV
يعني انداري  	LEV
جيبولي سيارة مشان الانبياء  	LEV
  شو بخاف دق عليك ومالاقيك شو بخاف بنص الليل ماحاكيك	LEV
 مروقه ومبسووطه + أحتسي قهوتي السآخنه  شو أخبارك انتي وكيف صبآحك 	LEV
او واحدة تؤبرني حتي طيب	LEV
  خبرتوه شو صار بجوبر وشوشوه بلكي ما عرف 	LEV
  شو صار معكم ما ع اساس الفزعة وخلص   	LEV
ياارب هون	LEV
  صار في شتا و ثلج و اعاصير بالخليج معقول يصير عنا مصاري 	LEV
اسمعلىمسمى هل انتي تالا شو معنى اسمك و صفاتك  احلىصباح	LEV
 كس امك شو حماره يا ختياره 	LEV
  يا ويلي شو صار فيهم  مقتل وجرح  من مرتزقة ايران بريف حماه الشمالي  بصاروخ تاو مبارك  تسلم الايادي  	LEV
شو مين ماخذة  رجل من  كاليفورنيوم مقنطر بال  سيلينيوم	LEV
حبيبتي منال شكلها دائرتك منغلقة ع فئة معينة منهم وسعي دائرتك شوي ورح تعرفي عن شو بحكي	LEV
  فيروز تذكرتك ياعلياء  وتذكرت عيونك  يخرب بيت عيونك ياعلياء شو حلوين 	LEV
 روء روء خيو شو مالك معصب  الدعوه ضحك	LEV
  ومساك عبدو حبيب القلب انت و ختيار	LEV
يضرب الحب شو بيزل	LEV
  يسهد مساك ختيار و للجميع	LEV
والله بالنسبة الي اغلب الفيمينست شفتهم هون وقحات	LEV
 اي حدا يناصر اي قضية مش شرط يكون محترم شو خص القضية بأخلاقه	LEV
قول إنى منيح مايجراش حاجه	LEV
شو يعني	LEV
 على شو مستعجلين في وقت هيك قال مبدع من بلادي ⁦⁩⁦⁩⁦⁩⁦⁩⁦⁩	LEV
  لو فيك تحكي للحبايب شو بني	LEV
بعده ما خلَّص شو  	LEV
اعترف شو مهبب	LEV
  ليش بالحب كلو بيمشي بالعكس ال ما بتحسلو بحس و بيتمناك ليش القلب اللي بدك ياه وبس جواتو غيرك شخص  وما بدو ياك نسخةمنك	LEV
 شو يعني هالشي موجود عنجد 	LEV
مش باقي اشي تبيعه كنا بنقاتل على فلسطين التاريخيه اوسلو ضيعت  بالميه انت ايش بدك تتنازل بدك تكتفي برام الله	LEV
أنا لا  صريح ولا وقح ^^ أنا حمدي حجازي واذا نسيت مين حمدي افتكر منيح	LEV
  يعني انداري  	LEV
انا والتهامي معاك    	LEV
شو بتقول لهذا الجوال  	LEV
  اروح العب طرنيب وتريكس شراكة أخسّر العالم واجلطهم بجواكر واتسلى أكتر من هون	LEV
نفسي اضحك لي بكره حد يقول نكته يضحكني  ه تذكرت ام محمود الي بجميل وهنا تقول يبليه  بقتلو القط الي عندي شو بيحب المخلل 	LEV
لاتربط الاحلام بشي منيح او لا	LEV
شو هالحاله	LEV
 اجل انتي مبدعة شو ممكن تسمعينا  شكلك ختمتي اذاعة طابور الصباح بالمدرسه 	LEV
  لكنها لسا ما تخرجت من مدرسه منيره للفجور والعهر لكن امك عم تعتني فيها منيح لتتخرج لتساعدها باداره المدرسة	LEV
 الله يوفقك بس بدك تخلصيه على التويتر	LEV
معيش مصاري ولا سيارة وخطي مفصول ومكانش في داعي اداوم بس اجيت لإني غبية وهلا بدي اروح وفش حدا يروحني ولازم ادرس للإمتحان وبس صباح الخير‍️	LEV
يا باسيل ارتاح شو بدك بصيدا و بهمها  نحن مبسوطين انه بصيدا حاملين القضية الفلسطينية و حاملين اهلنا اللاجئين 	LEV
ياه شو اديش صرلي نايم حتى خلص العالم  اكيد عم تسلبوها  ولي ليكون جد °°  نازل عل الحارة لشوف القصة ابو عبدو 	LEV
على مهلو  شو صاير عليه في وقت 	LEV
أعداء السعادة و الاستقرار شو هالعالم هي حسبنا الله ونعم الوكيل 	LEV
  ياليلّ شو حلو  	LEV
شو هي	LEV
  على مهلو  شو صاير عليه في وقت 	LEV
والي يحبك شو بنقلو 	LEV
يسعد صباحك شو حتربحنا مليونين ريال عند هلصبح	LEV
  قال شو قال الغرب هو من تآمر وحرض الشعوب العربية كي تثور على حكامها لو كان ذلك صحيحاً لما عاد كل عملاء الغرب إلى 	LEV
شو 	LEV
 السلام عليكم عندي مخالفة عدم ربط حزام الامان مع اني كنت رابط الحزام يوم خطفت على الشرطي شو الحل 	LEV
  شو يعني دسمة بدنا قنينة كراش بعدها  	LEV
  عريس بعد أرسل هدية للكوافيرة يلي جهزت العروسة فيها آيفون  لما فتحت العلبة لقت  فيها نوكيا  ه ورسالة مكتوب فيها 	LEV
بالله شو وقت واحد بيخون مرتو بيقولو مقصرة معو لو كافيها مادورت ع غيرو	LEV
سنان يقطعو شو كرهتو  حسيت عم بيحاول يقنع زينب انو تورنا عايشة بسعادة وانو بحاول يبعد زينب عن تورنا وقح  	LEV
  - الله ينولكم إلي فبالكم يا ولادي ويقطع نصيبكم من الفقر والعوزة  شو حلوة هالدعوة 	LEV
أوه شو كيوت 	LEV
اثار الحكيم كان الها مسلسل بتحكي دايما في السمس طلعت يا سي حمدي حدا بتذكر شو هو	LEV
ماشي حبو ياكبلز بس مش عال الصبح   شو الرواق الي عندكو  	LEV
لا اله الا الله شو هالاجرام هيدا  يا رب دخيلك القتل اسهل عليها يا ويلن من الله كفرة  ايمتى الدنيا ح تنتهي 	LEV
يزم شو الحياة هاي انتحر احسنلك	LEV
منيح ما الي اخت تلطش جلبابي اخواتي بيخبوا الجاكيت عن بعض 	LEV
 ماحدى يسألني شو هاي او كيف طلعت 	LEV
ع قولت واحد بدك تتخرجي بساهل شكرا	LEV
من زمان ما شمينا الروايح الحلوه مشان الله	LEV
  الشهيد باسل الأعرج المثقفالمشتبك يروي لنا  طلعت زلمة ارجع زلمة  لوالدة باسل ولولدة ناصر ابو حميد وكل ام أسير 	LEV
بدك تبقى فيك وبدك تمشي فيك هلأ مابيعنيني امرك  ولا بتأثر فيك	LEV
لهيك منفهم انه طالما هالنقاط ممنوع الخوض فيها لازم يصير في طلب تاني او يتم صفقة تنازل عن هالنقطة مقابل مدة سجن قصيرة بس بدك من يعملها	LEV
شو فيها وجع بس حلوة صباحك خير	LEV
  اللهم نسالك العفو والعافيه هو بشار شو سوالنا لحتا نحبه اخو الله لا يوفقو هو وكل من يأيدو عميل اي 	LEV
متل الشير عالفيس والكوتويت متل الشير وفوقا بدك تكتب واذا ما فهمت شي حكيني	LEV
الناس رايحة دبي تتسوق وتشرب وتهيص او تشتغل شو بدكوا بالمذهب يا عرصات	LEV
شو قال طيران مانو  مصلي  على النبي نازل ضرب بأولاد العرص  الفقيه 	LEV
ه شو هذا يا مرسيل يخرب بيتك زيدك ضحكنا	LEV
شو مين ماخذة  رجل من  فلور مقنطر بال  مايتنريوم	LEV
فينك تعمل ريتويت لرد الكومنتات وللتويت العادية  كلشي عادي هون عميل للي بدك ايا	LEV
شايف البحر شو كبير‍️	LEV
جمهور الهلال الملكي مع عموري وخل نشوف جمهور الانديه الثانيه شو بتعمل	LEV
اح معذبيني شو اسري فيهم	LEV
ادعو ليوسف ي جماعة هيقدم الامتحان هلقيت	LEV
يعني سنان أناني  علي صح وقح وبدو بس يخرب علاقة زينب و سنان بس بهاي النقطة منيح انو راح يخبرها بس المشكلة مش راح تعرف عن جاهدة للأسف 	LEV
  وحدة بتسأل حبيبها شو بدك تهديني على عيد الفلنتاين   حكالها بدي اهديكي عالصراط المستقيم ونتوب ونترك بعض   تكبير	LEV
يا ختيار هاي كرسة تعذي 	LEV
الله عليكي شو مثيرة	LEV
شو بدك بمكان شغلي 	LEV
كيف نسميه جبان وهو يقصف عب لو ما جبان شو كان بيعمل 	LEV
ليش شو بتعمل ايران عم تدفع	LEV
شو بدك بهالنزلة	LEV
صباح الخير  ما بعرف شو جابك على عقلي من الصبح	LEV
يعني شو بتتوقعو من واحد يومه حيخلص عال 	LEV
شو دخل السعوديه بالنص	LEV
ليش احكي انا هيك هيك مش عارفك بس يمكن هالشي يكون منيح	LEV
  عزيزتي الفتاة لا بقى تفكري حبيبيك شو عم يعمل وبشو مشغول  يعني شو بدو يعمل¿ يا مدفوس نايم يا عم يظبط غيرك نسعى لنشر الحقي	LEV
ربنا يوفقو ان شاء الله 	LEV
شو الي كان مدهور  دقص ايدي اذا بتابعي كورة شكلك ناسية ملقا واليوفي ذهاب واياب ورا بعض ذاكرتك صغيرة وقفت عند مباراة وحدة	LEV
رح كون بكرا مع ننوس مباشر على  مسرح سوقالتنين بعتولي شو بدكم اسألها و بشوفكم بكرا نانسيعجرم 	LEV
جيل لم يعش تجربة الاضراب الشامل  بدكم تطولوا بالكم عليه  كم تجربة ويصير الوضع تمام  بصير يعرف شو لازم يتسكر وشو 	LEV
شو يعني اندعم قصدك انعدم	LEV
شوف شو عملوا مع غيرك بتعرف شو رح يعملوا فيك 	LEV
لا شو الخطيبة احنا اهم محدش هينفعو غيرنا خصوصا فؤش	LEV
اهلي لسا هلقيت عرفو اني مأجز 	LEV
منيح ما رحت 	LEV
مرحبا  بدي ابعت الك فيديو شو طريقه	LEV
  عمرك ما تشوف شو ناقصك دايما شوف شو ربنا أعطاك وإحمد ربك دائما وابدا  الحمـّدلله على كل اشي	LEV
هسا القفلة حسيت للحظة انو زينب من تعابير وجها انو مش حامل ابصر كيف بس اتوقع حامل وله شو بدهم يخترعو انها يعني مريضة بمرض حامل عالاغلب 	LEV
ضرب المجروح قمة الجُبن 	LEV
الاذاعات المحلية شو قصتهم هم مش جزء من الوطن	LEV
تعني العزوبيه والعزاره اكيدمش هيك ختيار	LEV
ه متل ما بدك	LEV
تذكر شو كنت تقلي مهما يصير  انتظريني وضلك صلي  الله كبير	LEV
هي تلاقي كلب سلاقي يقبل فيها و كل شي منيح	LEV
وال لهالدرجة مدايقتك يعني ياخي انا ما بدي احلل راتبي انت شو زاعجك  حسبي الله بس	LEV
  بكير شو صاير عليك خليك نايم احسن	LEV
ياحرام شو تبهدلوا السوريين وكله لعيونك بشار ربي ياخذ عيونك 	LEV
يا وئام فيق فيق ياوئام الجماهير ناطرتك لتعرف شو رح يصير بعد المطار	LEV
  الحياةبتكمّل وقت تكون راضي لا حامِل هَم ولا ذِكرايات عالفاضي لتعيش وبالَك مِستريح مع الناس خلي فِعلَك منيح وسكِّر بواب	LEV
تسليك شو بالضبط	LEV
يسلم عمرك يالله شو بحب نغاشتك حتى على الاسك مش خلصان منها —  	LEV
  شو تعليقن على كلامها  	LEV
  تعني العزوبيه والعزاره اكيدمش هي	LEV
ع سيرة الغارات على مطار دمشق  شبيح النظام طالب ابراهيم كان عم يقول ع احدى الفضائيات من يومين انه روسيا راح تزودهم بمنظومة دفاع س  	LEV
شو قصة عادل بنت الجبيربيغيب  اشهر يلبس تياب النسوان و بس يولد من عشيقو بيرجع بدو يشيل الاسد من سوريا حدى يقلو انو متل الرغوة في تم الناقة	LEV
والله كلو وارد  هول بيقنعوا ل ما بيقتنع  بيكبوا مصاري	LEV
أها اذا هيك منيح  أصلا ما ستوعبت هالشي 	LEV
هسا خلينا نحكي جد لو حكتلك مين انا ممكن نتعرف شو رأيك — مين  	LEV
  والفحل مقوم ويصورني اللى بدو منحرفه كام يفوت شات هون  متسلطه فاجره 	LEV
انا بحب لبنان كرمال اليسا	LEV
الحياة حلوة بس انت ما معك مصاري	LEV
ما بعرف شو تعريف نجاح اللبناني عالمياً و فشله ع ارض الوطن 	LEV
لازم نصير يهود مشان العالم تحترمنا وتقدر انو نحنا بشر 	LEV
  كنزة  اضحكي يخرب بيت ضحكتك بضيع شعوب ووطن   	LEV
شو يعني تحييد	LEV
صاحيين لا عارفين شو ورانا ولا شو علينا الاجازة هاي ملهاش أي تلاتين لازمة  صباح الخير	LEV
وشوفى انا فاضى إذا بدك نطلع نلفف ع الفاضى	LEV
شو مين ماخذة  رجل من  نيهونيوم مقنطر بال  فوسفور	LEV
  الشعب كله نظارات طبيه شو هالعمى الي ضربكم فجأة	LEV
عيبياوزيرالسياحهاللبناني صباح الخير اسا الوزير ما فكر يعتذر شكلو ما بيعرف عربي اذا بتريدوا يلي بيعرف ارمني يحكيه بلكي بيستوعب	LEV
  النداء الاخير لركاب الطائرة المتوجهة الى لبنان انتو واعيين وفايقين ع حالكن شو عم تعملوا ولوين رايحين	LEV
س هسا بعد راح ترجع متل الأول بعد خسرت الشغل وتورنا راح تحس انو ما تغير اشي بحياتها بتوقع هسا تورنا تصير ادور ع زينب مش بعيدة	LEV
  احلى طلعه بكوفي شوب للتواصل معى فوت بالشات تبعى هون  مطيعه محرومه  خوال 	LEV
  نصيحه بس للبنات تعرف هي بتكلم مين وبتحط ثقتها في مين قبل اي حاجه عشان ماترجعش تندم انا مش مثالي ولا بعمل شو بس بتكلم في واقع ب	LEV
دكتور شو رأيك بهذا المنتج  	LEV
منيح  بعد ما خلصت الصبحية 	LEV
  بدك دولة ما تفكر بطايفتك  لأنو هيي بدا ياك معزاية عندا فكر بحقك كانسان ما يموت ع باب مستشفى ولا يتبهدل ع الطريق	LEV
كل مش عارف شو بابيها مش عارف ايش	LEV
لك مشان الله حاجتك جلاقة من عند الصبح	LEV
هون على الاسك صعب اما اذا بدك حط اسمك تاع الفيس وانا ببعتلك طلب وبحكي معك على الفيس  — اسم الفيس بوك نفس اسم الآسك 	LEV
واذا اتحاد الكرة وقع ليش ما يعلنون لين الحين شو الحكمة من انهم يخفون الخبر 	LEV
كرمال الله انتبهو على ولادكن و لا تخلوهن يروحو و يجو لحالن لازم و ضروري يكون معهن حدا راشد القاء القبض على 	LEV
أشتاقتلك أشتقأتلى بعرف مش راح تقالى طيب انا عم قلك أشتقتلك  هلأ عايش على هله بكره راح تستفقدنى تسأل مين كان يقل 	LEV
  فيروز | شايف البحر شو كبير  فيروزيات 	LEV
الله يسعدلي قلبك شو مشتائتلك 	LEV
عندي سؤال محيرني من انا صغير شو يعني 	LEV
شو اخبار النشرة الكميونية لهيدا اليوم في تسكير طرقات	LEV
بلكي صحون طائرة 	LEV
عبد الله ابو شرخ ماذا فعل ليتم اعتقاله  هو الامن الداخلي فاضي وعنده وقت زيادة وللا شو القصة 	LEV
تتحدثين عن شعب وصل الى مرحلة الانسانية ليس فقط تجاه الانسان بل تجاه الحيوان والطير وحتى الحشرات والبي 	LEV
ايها  الظلم قديش  بدك  تضلك حاكم بل  اخر  بدك تموت	LEV
  بجرّب ما بفهم شو علّقني بَس فيك️  فيروز 	LEV
  خليك بلا شي مشان ما تخسر شي 	LEV
عادé شو الناس ملكي يعني	LEV
يفتاح يرزاق  من شو التعب	LEV
بشوف بلكي جيتك عالجامعة	LEV
شو هيدي جزم الخشب 	LEV
اثر السهر بلش يطلع	LEV
سوريا شو صار بقصة أوامر الرد  على اسرائيل دون العودة للقيادة	LEV
من التبذير إنك تطلب كاس قهوة بـ دينارعشان مخ ما بسوى شلن 	LEV
طب ممكن السبت ييجي مشان البروڤا️	LEV
دورت عليه ما بين حط اميل الفيس بلكي لقيتو — موجود بالبيو 	LEV
البشع بالشغل لما يكون في حدا صوتو عاليوبضل يجعر ويعيط  شو الحل يا ربي انطوشت	LEV
  اذا حلوة رتويت اللى هايج بدو خرق كام يفوت شات هون  جاده بتش 	LEV
اذا مش فاهمني بلكي بنحكي موسيقى	LEV
  أنا بدي ياك و أنت منك عارف شو بدك	LEV
هسا شكلك حطيتو لا انو ما كان مبين — لا من زمام 	LEV
حمسنها شو يعني واضح اسم السومة يربككم	LEV
يعطيكم العافيه فينا نعرف طريق بيروت باتجاه صور شو وضعها	LEV
هسا شكلك حطيتو لا انو ما كان مبين — لا من زمان 	LEV
بس قدام افا عليك و شو رايك تدخل  بعد شوي	LEV
السيادة الوطنية صارت بالأراضي يا شحاري  	LEV
الحمدلله شو اخبارك	LEV
ما عم يتذكر شو عبد 	LEV
  عن وجع اليسا لما قالت  شو صعب انسى حبيبي و الاصعب كمل حياتي 	LEV
بدك تتركني وتروح الحمد لله على نعمة النسيان	LEV
  و هون بيصير في سعادة سحرية  	LEV
خيو احمد شو عم تقول  تعريف الدراما هو الاحداث الجادة واشوف ان المانجا مليئة بها  رغم ان القصة فيها اك 	LEV
شو مين ماخذة  رجل من  موسكوفيوم مقنطر بال  بلاتين	LEV
شو اخبار الغاز بطَّل إحتلال 	LEV
