	LEV
 علي حبيبي طز هاي اسم  القمه ولا شو	LEV
  دائما في حدا بشـجعنا نقوم من النوم نرجع نواجه الحياة وروتينها كرمال ضحكة أو تطليعة أو حتى كلمة حلوة	LEV
شو اضيف ما فهمت مع الششكر	LEV
شوفي والله انا يمكن ادافع عنها لانه اشتغلت معها عمل تطوعي مع السوريين بالاردن وشفت شو قدمت بدون بهرجة وتصوير	LEV
الضحك تعاقب عليه المادة مدري شو هيي 	LEV
  دير بالك على امك يالبعدها وياك ومو فوق الظهر على الراس خليها 	LEV
شو يعني الشعب الحر  يعني ياكل و يشرب و يجلي يلي بدو ياه اكيد لا الشعب الحر يعني بكون الشخص عندو تفكيرو حر و 	LEV
  الأردني كيف بدعي يا رب  مشان الله 	LEV
  شو عم تسمعو الان اغاني  سمعوني معاكم	LEV
 يا ريت تنحسد  بلكي عقلت شوي  المهم شو مالها علا الفارس ع هالصبح  	LEV
  صبااح الخير والحب عشرينيه للتواصل معى فوت هون  مشتهيه جنوبيه  نيج 	LEV
  جمعةمباركة على الجميع  شو مشاريع الويك اند    	LEV
انت الغلطان التويتر هيك لازم تعمل مشان الهاشتاق يوصل الترند	LEV
منيح ما كان حامل كان سقّط	LEV
لما الشب معوش شيكل فجيبتو  وتحكيلو الوطن شو بدو يحكي للوطن	LEV
بحبك بحبك انتي الشرف والطيبة مشان هيك خافوا ونسيو اساميهون وشرفون وعرضون 	LEV
بلش فيلم الاقزام ال القمةالعربية	LEV
وشو المشكلة شو بيشكي الرئيس بشار الأسد بيكفي قلبو عالبلد وهالحرب كلها لأنو رفض الصلح مع إسرائيل وفضل عدوتكم إيران	LEV
شو مين ماخذة  رجل من  إثمد مقنطر بال  قصدير	LEV
شو بحلل هذا الخرفان	LEV
شو الفرق يعني بين الآسك وصراحة نفس الفكرة انا شايف 	LEV
بدك بيتزا اموله	LEV
  صباح الخير ختيار 	LEV
بلش فيلم الاقزام ال القمةالعربية 	LEV
فوايدالاختلاط الاحتكاك مع الحكوكيات يئبرني شو مهطومات	LEV
طيب شو بدي اطلب  بدي ايفون  احمر بمعيتك 	LEV
شو ما كانت ظروف عاملات المنازل أو شروط استقدامهم بضل بالموضوع انتقاص لشخص  التباهي في أو عرضه كأنه موضوع عادي بدل على جهل او غباء	LEV
بإختصار برنامج كان بدايته للفضيحه والمحتوى المخالف بالعقل شو فايدة اشوف شي باقل من  ثواني ويختفي بمره 	LEV
كل تخطيطي لحياتي يبدأ بـجملة ٖ لو معي مصاري 	LEV
يعني لو يعملو  قمم عربيه بانحاء الاردن  رح تتزفت كل شوارعنا بشكل مثالي  طريق البحر الميت بيقلك زي شوارع اميركا هسا	LEV
هلأ إذا بدك تعتبر الإيرانيين مو مسلمين هذا شأنك بس حضرتك بدون ما تحس عم تخدم إسرائيل وبين إيران وإسرائيل أكيد إيران	LEV
الشي المفيد وخاصه هم الان ب الاردن اكلة المنسف  	LEV
ايه منك شو ويطير عقلك	LEV
بحقل الوجع في حزن بالتربة انزرع وانت ال كان وقت بدك كون حدك صار بدك تكوني ملك الغريب  ولا كون ولا لحظة بقربك بحقل 	LEV
امنالدولهوفولورزالصواريخ شو قصة الزعماء بوقعوا واحد ورى الثاني مبارح حاكم دبي واليوم رئيس لبنان 	LEV
 -  يارا - عمغني  عم بــوح بأسراري شو عملت النار حرقتلي مشواري وضيعت أفكار  ️ 	LEV
وفاء بتنزل الوزن شي هيدي  و شو احسن ماركة جيب منها بتنصحيني اذا بتعرفي 	LEV
انا الي بعرفه انه حالياً حلبس واطلع و شو ما يكون يكون	LEV
أهم شي يضحو بالعرض مشان يمدو المقاتلين بالطاقه اللازمه للقضاء على الإرهاب	LEV
منيح إنو في قهوة بالدنيا ولا كان هسترنا يا شيخ 	LEV
 بلش بالاخير ترا	LEV
وشت وشت عوی غیر هون وشت	LEV
طيب شو الفرق بين قانون ال و اي قانون مطروح حاليا ليش غيرو اصلا اذا الفرق بينهم بس توزيع الدوائر	LEV
خمسهعبيدصغار شو قصة الزعماء بوقعوا واحد ورى الثاني مبارح حاكم دبي واليوم رئيس لبنان 	LEV
  نجمة من بلدي رغم كل وجعا بترجع بتقول يا رب وبتكمل كرمال جمهورا آخ لو بتعرفو قديش بيمرق عالفنان الحقيقي وجع وبيكمل 	LEV
 فيه حدأ هوون  بلكي مشتائقين	LEV
  اهاا  بس قالبين قلبة اخت شلن  شكلو شي كبير 	LEV
ما حكينالك اللي فينا مكفينا ناقصنا احنا زعماء  ما كلها هون زعامه 	LEV
شو نسيتي المتل لي بقول طنش تعش تنتعش	LEV
مافهمت شو قال احمد خليل	LEV
  المراسل هل صحيح انك لعبت دور فيما يتعلّق بالاجماع العربي على بند التضامن مع لبنان في مقررات الجامعة العربية الحريري ا	LEV
صحيح الناس شو ذنبهم اذا مزاجك معكر تنكد عليهم 	LEV
ضغطت ع  ترانسكشن مرتين عشان ابا اشوف شو داخله واختفى  سكرت البرنامج وشغلته وبعده مختفي  	LEV
يا تبع حساب هدف استراتيجي بس توصل لمستوى بوط العقيد زكريا ابقا حكي عليه	LEV
منيح خشب الارضية المرتفعة مش اسمنت  انت شوف طيبة قلب السيسي و انسانيته 	LEV
خاطري ف شي بس ماعرف شو هالشي	LEV
  وين بينباع هيك لبس 	LEV
بعرفكم ع فدوى مصممة المجوهرات والأزياء الرائعة من لبنان ومقيمة في المغرب  انت ابداع اخت فدوى ومعزتك بقلبي 	LEV
اخوي مش هو الي عامل حالو حاط الزلمة كان مستضيف الدورة الماضيه لهيك بحكي اول واحد شوف الملك هسا بسفح	LEV
يا عيب الشوم عليه	LEV
وعليكم السلام خير اخوي شو فيه	LEV
انا الملك هون 	LEV
تباً مش وقعة  بعدين شو قصتهم كل يوم واحد واقع  	LEV
شو بدك انتي ياسعوديي لشو هاد الحسد والعنصريي 	LEV
بلش التصفيق ياسلام سلم 	LEV
عارفين فرح شو عملت فرح فقعت بالون اسمه علا  و هذا يا إخوان اللي حكى عنه شيكسبير 	LEV
 انت شو قصتك اليوم  ماحبيت مودك اليوم وانت صاير حكيم	LEV
انتي لوينتا بدك تضلي زعلانة 	LEV
  يما اعطيني مصاري بدي اطلع مع صحابي يما يا حبيبي معيش مصاري؛ والله يرضى عليك بلا 	LEV
طب معك علكة 	LEV
شو بنى   ومجروح بجروح  الهوى  شو  بينفعوا الله الله  عليها 	LEV
  ولما طل القمر سألني شو الخبر قلتلو عشقانه	LEV
هون الفخامة جلالةالملكعبداللهالثاني القمهالعربيه	LEV
ع فكرة حافظها منيح لهالعبارة ع كتر ما رددوها حكام العرب والغرب	LEV
مفتاح السيارة وين يا باراك وباما 	LEV
 شو اتصبح بهيك جمال  بونجور  يا قمري 	LEV
  تمام سلام ذكرني بعبارة زياد الرحباني الشهيرةفكرنا راح المنيح طلع منيح اللي راحشكلو كان حابب دور اجر الكرسي بالدولة وع	LEV
  خلاص الحجاب معروف شو ظوابطه بدك تكوني ستايلاش تتحجبيش و فكي اهلنا من التخبيص	LEV
  تويتة لازم تتعلق عباب كل جامعة ومؤسسة 	LEV
شو متعة اللعبة هيك تخسر مباراة حاسمة ولا بطولة بسبب حكم	LEV
  مش بعيدة علا الفارس بكرا تعطي للبنات اللي صورتهم مصاري عشان يطلعوا ويدافعوا عنها	LEV
لو بدك مصمم انا جاهزه صحيح م بعرف بس نتعلم	LEV
طيب بديش اصلا 	LEV
  اه مشان الشهرة  المهم تعتذر عن اللي قالته وخلص	LEV
طبعاً طبعاً شو فهمنا احنا بالوطنية	LEV
قمة نشوة الانثى للتواصل معى فوت على الشات من هون  ثلاثينيه ساديه  خرق 	LEV
في لعيبه في الدوري افضل من هاذول اللعيبه بس المدرب باين عليه انه معارف يشتغل صح شو الي عاجبنه في صنقور وهيكل 	LEV
خدلك ملا اعلام مصخرة هلق حيهلكوا ربنا بهالفيديو والله عيب اذا فيكن نتفة رجولية واخلاق مابتتمصخروا ع ختيار وقع مين 	LEV
  يخرب بيتك ما اكدبك شو دخل داعش بينك وبين مطار دمشق  كل سفالتكم ضعوها برقبة داعش 	LEV
 المشكلة اذا بدي اكتبها بلهجتي انا رح لاقي  يتطلير عندي  ولا شو رايك  	LEV
شو هالذكرى التراللي جوزيف دقماق  	LEV
كمشخصمفعلالتنبيهاتله شو قصة الزعماء بوقعوا واحد ورى الثاني مبارح حاكم دبي واليوم رئيس لبنان 	LEV
 القمة العربية هي عبارة عن حاكم مش خليجي بيروح ليشحد مصاري من الحاكم الخليجي هيك شي بيشبه البنت تبع اشحنلي كرت واعرضلك على نفس المبدأ يعني	LEV
 ه بسيطة ابن العم غرد على كيفك هون	LEV
اختلاف ثئافي شو بعمل️	LEV
يازم خلص لا تذكرني  مش عارف شو بعمل 	LEV
لك لاعاد حدا يتغالظ شو عكيفي بحب انا مشان مااحظر الزاجل كرمال عيونكم 	LEV
  ئلي انك حاسس فييّ وشايف شو بيحكوا عينيّا	LEV
  بدناش عطلة لا هسا ولا بعدين تمام بس زبطونا جدول امتحانات الثانوية العامة الادبي وتعملوش فينا زي الفصل الاول مواد بيوم	LEV
في امهات كتب الكذابين  يخرب بيتك شو كذاب 	LEV
عزا ماله شو صار فيه 	LEV
فتحت مسلسل جوي وصدعت من الجمال ياربي شو ها كيف بتحمل	LEV
دير بالك كمين	LEV
منا عرفت شو قصدك  بحبش احطها بحسها بتخرّب منظر الشاشة	LEV
بنت التور نفسي اشوف لك تفريده خاصه شو	LEV
عن شو بدي أحكي عن الستايل الجديد ولا الضحكة و لا الغمزات ولا النظرات ما بقدر قول غير سبحان الخلاق العظيم  	LEV
الله يالدنيا الأرجنتيني ماريو كيمبس بطل مونديال  شوف السنين شو عملت 	LEV
اوف الاجازة بتجي  شكلي باقلب نظامي ليلي عشن مااشوف شي 	LEV
صورة فيها كثير مصاري 	LEV
نجوى امتى حينزل الالبوم قديش بعد بدك تقولي قريباً شو هالالبوم الي من  سنين ما عم ينزل شو عم تخترعو فيه	LEV
  ركضنه على الرصاص الجاي حفاي  وتنافسنه على صواب المنيه  نگله الي ما مصوب حتى نرضيه  اصبر بلكي اتحصل شضية 	LEV
  شو النفع إذا مستشاري الرئيس راتبهم ليرة وحدة  بس في م مربع ببيروت  مستثمرتن شركة مقابل ليرة بالسنة	LEV
شو عم تقول 	LEV
روح اتركني لحالي اتركني وروح بكفي قلبي مليان جروح  شو بدك فيه  لا حب بقلبي خليت	LEV
شو هوا قوليلي نتي شبك	LEV
  أحرارالشام يا ويلي شو صار فيهمتدمير دبابة لميليشيات الأسد على جبهة الصخر بحماه  تسلم الأيادي ما أجمل الربيع 	LEV
  مسآء الخير حبآيبي يلى بدو ممحونه كام يفوت شات هون 	LEV
شو طلعت القصه 	LEV
ماهو نص الستايلش متل ما سميتهم مش مقتنعين بالحجاب من اصل  بلبسه فقط خوفاً من  اهلهم 	LEV
منيح ما ينجلط وننبلي فيه	LEV
  جداويه للتواصل معى فوت على الشات من هون 	LEV
  عادي جداً كون بحبك واعمل كل حركات الدنيا مشان طفشك وتصير تكرهني	LEV
وعدت لها اكثر من مره لدرجة كنت بنمسك وهي تقول لي تفاح بديش وبعدي صارخت بسوت عالي بتاح تكفا واخدو ورقتي	LEV
و فجأة بطلعلك شخص جميل بحياتك  ل درجة انك بدك تعيد كل سنينك و تخليه فيها 	LEV
  تتفلسفش عالأردن  مابرد وجهك  سنحك وانتَ زارع شعرك 	LEV
انت شو فهمك بالموضة و الستايلات عشان تتفلسف  	LEV
  قمة نشوة الانثى للتواصل معى فوت على الشات من هون  عنيفه ارمله  امامى 	LEV
  يعني انتحر ولا شو اعمل بالضبط  قبل لا يفوتك القطار مثلا  ه الحياهلاتنتظر	LEV
  شبيحات الوطن كتيبة خنساوات سوريا الأسد بالقامشلي بلسانها قالت بدنا نضحي بالارض والعرض كرمال الوطن الارض والعرض  ا 	LEV
 شو عملت ما بتابعها	LEV
سمعت فلان شو صار معه  لا ولك وين عايش انت  عايش بحياتي مش بحياة الناس  	LEV
اش هون  ليش مختفيه	LEV
  لعيونكم حبايبي للى بدو محرومه كام يفوت شات من هون 	LEV
ياشايف الزول يا خايب الرجا محدش يقولي شو بعني في كلامي انا قلت وانت احزروفزر وحلل واتكلم وما تسألنيش انا مش ناقص	LEV
  اهم شي خدامتهم ماتعرف 	LEV
  يا فنان بنزل السرور بيّو لى عباس مات لقنو مامعو مصاري يفوت عمستشفى و هاي كاتبها زياد بال  وفهمك كفاية 	LEV
شو قصة قمة الاردن و السقوط  واحد تفركش ع درج الطيّارة  و واحد تعثّر و وقع  و الآتي اعظم قمةالسقوط قمةساقطة	LEV
هاي ع طريقة انتو اطلعو و انا بس شسمو بلحقكم	LEV
قلي دخلك شو فيك حتى معلقني فيك 	LEV
هو أنا بحضر ستوريز ال  وال  مشان أحضر هدول 	LEV
انو يعني ناطرين ال حديد ياكلو منقوشة حتى نتعرف عالمناقيش شي مسخرة او يعني المنقوشة اكل الفقير وقطيعة تقطع اللي عامل 	LEV
- شو موهبتك  - بحرق إيدي كل ما ولّع الغاز  - معك  نعم	LEV
اوف شو بتنحبو وانا اصلا عندي فوبيا من الإبر	LEV
احمدسعود محترف ومارس برنامج واقعي غريب انه يسوي هالتصرفات تعودنا انه قبل التصويت يسوي شو بس هالمره استعجل	LEV
شو المطلوب منا	LEV
شو هاي شو عاملين	LEV
 الف الف سلامة ع قلبك يا قلب  شو هالانفلونزا الصيفيه موت 	LEV
وين نروح خربو كل البرامج	LEV
  مساء الشهوه واالنيك عنيفه فوت بالشات تبعى هون  خبيره مزيونه  تجليخ 	LEV
داعش اللي اخترعها بلش فيها الله يستر من كاحش ولا خاحش مستقبلا	LEV
شو مين ماخذة  رجل من  سيلينيوم مقنطر بال  بالاديوم	LEV
يا آنتي كان هون كائن فضائي بس منيح انه كبّر	LEV
السعوديااجملرجل  شو هالحكي يازلمه  	LEV
قال شو موريتانيا بلد المليون شاعر ورئيسها مش عارف يحكي كلمتين عبعض 	LEV
اللي ما بدو يحترم الرئيس من منطلق الخلاف السياسي يعتبرو بيو او جدولِك يعتبرو ختيار ما بيعرفوكان بيشمت فيه اذا وقع زمنالسقوطالأخلاقي	LEV
يارب امي هون عليها يارب لها عمري و عافيتي ف اعطها يارب لا تجعلني اشوف الحزن في عيونها 	LEV
اه ماشي كوني نورية وانت محجبة    اوعك تكوني ستايلش بتدخلي جهنم  	LEV
شو هاظ  ياعيب الشوم وياحيف ع النشاما 	LEV
 اي شفت شو مخلصة يلا هات احكي 	LEV
كلها وقعت شو القصة	LEV
  شو نعمل يارشاشو نعملنتعلم فن اﻹتكيتربما نحتاجه علمتني الحياة أن كل شيء ممكن 	LEV
شو لخلاك هل قد متأكد ومين خبر عن مصطفى بدر الدين وسمير القنطار وصفى	LEV
شو اللهم احفظ لي 	LEV
  يومياتمگرود اكثروا من الدعاء على الساسة بهجمان بيوتهم بلكي رب العالمين يستجيب دعاؤكم ويشغلهم عنكم	LEV
بسم الله عليه هالشيخ شو مسخن ومهضوم وحرك  ربي يحميهم شو بحبهم هو وابوه 	LEV
حدا يفهمنا شو يعني كلمة قريباً يمكن نحنا ما عم نفهمها لهالكلمه	LEV
الي اسبوع م بروح عالجامعة والاسبوع الجاي رايحه مشان عملية عملتها	LEV
  شو حلو يكون نجمك هوِّ حاميك  حملة إنسانية هدفها التبرع لجمعية حماية لي تُعنى بحماية الأطفال من خلال مزاد لغرض شخصي 	LEV
شو هالدبقة اللي متسلط عليك اليوم  بكل تغريدة بنط وبعلق	LEV
أخطأت المكان افضل هريسة كانت في ريف حماه وخاصة في معرزاف وعلى يد افضل الطهاة ثوارنا وباعظم ادوات التاو  تعيشي وتا 	LEV
ليش شو شغلتكن بالقمة ليش اجتمعتواوقت بدنا نروح جنيف لاتجيبو سيرتنا بقمامتكن 	LEV
  -لك شو وينك ماعم تسأل -خيي لأني تمام الحمدلله وانت منيح الحمدلله واخباري الحمدلله وانت مشتقلي وانا بالاكتر وخلينا نشوفك وانش	LEV
 له له يخو	LEV
ه منيح اللي توحمت عالمناقيش	LEV
يعني خالتي بتحبيها اما آنتي لأ والله الواحد جننتوه مش عارف شو يقلكو	LEV
  شو إسمك مؤيد  وماأحلاك تكون معارض	LEV
مسجد حارتنا بمثل دور المسجد في بداية الاسلام  و بنقل القمة بسماعات المسجد	LEV
  الحب كالبصلة قشرة فوق قشرة ثم لا شيء في النهاية غير الدموع والحسرة شو رايكم بالكلام بكمل ولا بسكت 	LEV
يا قوم شو غداكم 	LEV
 سجل عندك شبيح بيكي جديد 	LEV
صباحك سكر انا منيح كيفك انتي	LEV
الريال مسؤول عن إيقاف ميسي بيريز دفع مصاري لإنفانتينو وسمعني صياحك	LEV
  قصتنا  كبيرة  نحنا والنقطة  يخرب بيتك ياهل النقطة  شو عملتي 	LEV
كانوا يواجهون اسود الشام مع رجال الله والان الدب الروسي  شو بدوا يصير فيهن  حرب عالمية ناعمة في سوريا بالنار	LEV
و شو ال مصدر و هيك 	LEV
منيح ما توحمت على تمساح كان صارت اكلة شعبية	LEV
  والله المضحك المبكي بهاي البلد انه لو شو ما كنت دارس وعندك خبرات ما بفيدك الا ال 	LEV
وهو الطيار شو يسوي غير يطير الطياره وينزله طول الرحله يخليها اوتوبايلوت 	LEV
شو كانت حلوة الليالى	LEV
شو علاقة اللوز بالملح  ️	LEV
طب شو كان صار لو كل حدا بيعرف حالو و قدراتو و ما بيعمل شغلات مانو أدا	LEV
إنت قلت شبيح والشبيح نبيح 	LEV
  شو بتعني بن الي ما فهمها لايك لتجاوبنا نور	LEV
مشان الله طول بالكولا تعسب	LEV
  ممحونه بدى قطرى جاد يفوت عالشات تبعى هون  ساديه عنيفه  جماعى 	LEV
  تحليلي بالتفصيل الممل  شو هي خطة الب وخضر واونال وداوود 	LEV
  بليز شو بتعني لن او 	LEV
شو خرط عليهم	LEV
ه لسا لسا بلش المسلسل الكوميدي حتتضحكي كتير	LEV
اخ كنت بنام بس اشوا ذكرتيني	LEV
  يا طير  يا طاير على طراف الدني لو فيك تحكي للحبايب شو بني يا طير 	LEV
بقول احنا لاجئين هون 	LEV
لو مستعد يلبس حجاب مشان يعرف يقابلك أتجوزيه   هزاعوف 	LEV
اذا كوكب الارض بذاتو بلف وبدور  شو متوقع من سكانو 	LEV
  الي حط جدول الفاينل ليش مستعجل شو وراك حبيبي	LEV
البحرالميت  بتعرفو انو حبيبي يلي قتلو   يؤبشني شو حمش وأبضاي 	LEV
ارفع عيونك فوق للسماء شبيهك اليوم اكتمل >> كيفك  — ه شكرا من زوقك  الحمد لله منيح  كيفك انت  	LEV
  شو شعور النساء اللي شاركت وشاركنا صورهم اشي بيوجع القلب  الواحد يدفن حاله أحسن عالقرف اللي معبي هالكوكب مش ملاقية حكي	LEV
خزان شو ه 	LEV
شاركونا بفقرة أولمرة هذا الخميس عن اول مرة ركبتوا فيها  دش شو كان شعورك  و كيف أثر هالشي على حياتك 	LEV
  شو حابين تاكلوا من ايدين  الشيف ايلي  ‍ 	LEV
  تتزكروا هاي الصورة أنا بدي خليك تعرفوا أكتر شو هو الفيديو الجاي خبروني شو رح يكون الفيديو الجاي  	LEV
فكونا من علا الفارس مشان الله️	LEV
انو كم مرة بتعرضوا الفيديو  شو هالسخافة هيدي	LEV
شو رايكم بهذه اللقطة	LEV
 تاريخ رح يحكو فيه أجيال  ليش  متل اليوم خسرنا وطن  بس  شو السبب السبب منا وفيناماحبينا بعض ست سنين عم نقتل بعض ياحرام	LEV
يعني مش فاهم  شو راح يعملك الشعب السعوطي ‘إلي يتبع ال سعود إلي جائو بالسيسي  هم يرون ولاه خمورهم على حق	LEV
بوكينغ السماكدون خربو ام الواقعية بين اورتن وبراي	LEV
- شو كلمتك المعتادة لما تطلب شاورما   -انا  كثرلي سلطة تركية  	LEV
  طموحنا نهاجر  و نبعت مصاري لأهلنا 	LEV
  شو سـهل آلـحكي مين الـ بيعـرف بقلـب التآني شو فيه  	LEV
نمت ولا ذاكرت  اشوا اختبرنا الرابعه	LEV
  لو هم تغيروا ذكرياتهم شو الي يغيرها	LEV
 شو قصة الوقعات بهالقمة بلشها امير الامارات على درج الطائرة وهاي الرئيس عون بالقاعة انشالله بالسلامةوبمين رح تنتهي  بالبيان	LEV
شوفي  شو صاير ولا يستر ع أختك رجع الفيس	LEV
رئيس ماسك موبايله والثاني بتثاوب واحد فاتح ثمه و واحد بسولف مع الي جمبه  ولا واحد منتبه ولا بسمع قاعدين غصب عنهم  شو المسخره هاي	LEV
  كفشتك ياشو أنت 	LEV
 هذا اسمه تحشيش مو راحة ضمير	LEV
ابو غيط كلامه بهيجقال شو العروبة موجودةبس بقى تفنيصهاي الجامعة لو بتسكروها وكل واحد يلعب ادام بيته	LEV
بشرب منه اذا بدك 	LEV
بلكي يخفضون عقوبة ميسي لعبتين من ضمن الوديات ويلعب ضد الأوروغواي	LEV
بدك طولي بالك	LEV
شو هالسؤال  سؤالك مش مفهوم مش عيب عليك دكتور و تنزل عيك بوست مش مفهوم منو اشي	LEV
انتو راجعين تتمعشقو وانا شو دخلني 	LEV
  ع ايام الورد قلبي دايب كيف كنا وكان العمر طايب شو جرى شو غيّر الحبايب مرقوا ع بابي وماحاكوني 	LEV
